{
  "schema_version": "1.0.0",
  "record_type": "candidate_change",
  "id": "candidate-review-senolytics-pubmed-snapshot-provenance-2026-06-27-safety-limitations-repair",
  "name": "Safety limitations review for Senolytics PubMed snapshot provenance repair",
  "summary": "Adds the missing supervisor safety_limitations evidence review for candidate senolytics-pubmed-snapshot-provenance-2026-06-27 without promoting or mutating the target candidate.",
  "lifecycle_status": "submitted",
  "submitted_at": "2026-06-27T19:58:54Z",
  "scope": {
    "question": "Create the missing safety_limitations review lane for candidate senolytics-pubmed-snapshot-provenance-2026-06-27.",
    "hallmark_ids": [
      "cellular_senescence"
    ],
    "track_ids": [
      "senolytics"
    ]
  },
  "proposed_records": [
    {
      "record_type": "candidate_change",
      "record_id": "candidate-review-senolytics-pubmed-snapshot-provenance-2026-06-27-safety-limitations-repair",
      "path": "data/candidate-changes/candidate-review-senolytics-pubmed-snapshot-provenance-2026-06-27-safety-limitations-repair.json",
      "change_type": "create",
      "rationale": "Tracks the bounded repair candidate that adds the missing safety_limitations review lane for the target candidate."
    },
    {
      "record_type": "evidence_review",
      "record_id": "senolytics-pubmed-snapshot-provenance-2026-06-27-safety-limitations",
      "path": "data/evidence-reviews/senolytics-pubmed-snapshot-provenance-2026-06-27-safety-limitations.json",
      "change_type": "create",
      "rationale": "Records the supervisor safety_limitations verdict for the target candidate."
    }
  ],
  "required_review_lanes": [
    "safety_limitations"
  ]
}
