{
  "schema_version": "1.0.0",
  "record_type": "candidate_change",
  "id": "coverage-gap-senolytics-exact-effect-extraction-followup-3-repair",
  "name": "Senolytics exact-effect extraction follow-up repair",
  "summary": "Clarifies the senolytics coverage-repair record after the bounded extraction-refresh review: DKD, IPF, and AD-risk PubMed snapshots support only metadata-level abstract extraction, D+Q bone article and registry material remain source-located, and full article/table extraction debt remains open for DKD, IPF, AD-risk, and D+Q supplement material.",
  "lifecycle_status": "accepted",
  "submitted_at": "2026-06-29T20:07:12Z",
  "scope": {
    "question": "Repair the senolytics exact-effect extraction follow-up coverage gap using the scoped PubMed, ClinicalTrials.gov, and PMC author-manuscript snapshots without promoting or claiming full article/table extraction where retained artifacts are absent.",
    "hallmark_ids": [
      "cellular_senescence"
    ],
    "track_ids": [
      "senolytics"
    ]
  },
  "proposed_records": [
    {
      "record_type": "candidate_change",
      "record_id": "coverage-gap-senolytics-exact-effect-extraction-followup-3-repair",
      "path": "data/candidate-changes/coverage-gap-senolytics-exact-effect-extraction-followup-3-repair.json",
      "change_type": "create",
      "rationale": "Tracks this bounded extraction-refresh repair candidate and its required review lanes."
    },
    {
      "record_type": "coverage_assessment",
      "record_id": "senolytics-coverage-repair-2026-06-21",
      "path": "data/coverage-assessments/senolytics-coverage-repair-2026-06-21.json",
      "change_type": "update",
      "rationale": "Clarifies that the DKD, IPF, and AD-risk PubMed EFetch snapshots are metadata-only abstract sources, preserves the D+Q retained registry/PMC article support, and keeps full article/table and supplement extraction debt explicit."
    }
  ],
  "required_review_lanes": [
    "extraction_fidelity",
    "safety_limitations",
    "synthesis_boundary",
    "taxonomy_mapping"
  ],
  "evidence_review_ids": [
    "coverage-gap-senolytics-exact-effect-extraction-followup-3-repair-extraction-fidelity",
    "coverage-gap-senolytics-exact-effect-extraction-followup-3-repair-safety-limitations",
    "coverage-gap-senolytics-exact-effect-extraction-followup-3-repair-synthesis-boundary",
    "coverage-gap-senolytics-exact-effect-extraction-followup-3-repair-taxonomy-mapping"
  ],
  "promotion": {
    "target_status": "accepted",
    "promoted_at": "2026-06-29T22:07:08.889Z",
    "promoted_by_agent": "promote-candidate",
    "reviewed_review_ids": [
      "coverage-gap-senolytics-exact-effect-extraction-followup-3-repair-extraction-fidelity",
      "coverage-gap-senolytics-exact-effect-extraction-followup-3-repair-safety-limitations",
      "coverage-gap-senolytics-exact-effect-extraction-followup-3-repair-synthesis-boundary",
      "coverage-gap-senolytics-exact-effect-extraction-followup-3-repair-taxonomy-mapping"
    ],
    "summary": "Promoted to accepted after all required active review lanes passed."
  }
}
