{
  "schema_version": "1.0.0",
  "record_type": "candidate_change",
  "id": "candidate-review-coverage-gap-senolytics-safety-tables-followup-2-repair-synthesis-boundary-repair",
  "name": "Supervisor synthesis-boundary review for senolytics safety-table repair",
  "summary": "Adds the missing synthesis_boundary supervisor review record for candidate coverage-gap-senolytics-safety-tables-followup-2-repair and records an accept verdict without promoting the target candidate.",
  "lifecycle_status": "submitted",
  "submitted_at": "2026-06-28T19:51:51Z",
  "scope": {
    "question": "candidate_review: Required review lane is missing: synthesis_boundary.",
    "hallmark_ids": [
      "cellular_senescence"
    ],
    "track_ids": [
      "senolytics"
    ]
  },
  "proposed_records": [
    {
      "record_type": "candidate_change",
      "record_id": "candidate-review-coverage-gap-senolytics-safety-tables-followup-2-repair-synthesis-boundary-repair",
      "path": "data/candidate-changes/candidate-review-coverage-gap-senolytics-safety-tables-followup-2-repair-synthesis-boundary-repair.json",
      "change_type": "create",
      "rationale": "Tracks the bounded self-healing repair for the missing synthesis_boundary review lane."
    },
    {
      "record_type": "evidence_review",
      "record_id": "coverage-gap-senolytics-safety-tables-followup-2-repair-synthesis-boundary",
      "path": "data/evidence-reviews/coverage-gap-senolytics-safety-tables-followup-2-repair-synthesis-boundary.json",
      "change_type": "create",
      "rationale": "Records the supervisor_agent synthesis_boundary lane review and accept verdict for the target candidate."
    }
  ],
  "required_review_lanes": [
    "synthesis_boundary"
  ]
}
