{
  "schema_version": "1.0.0",
  "record_type": "candidate_change",
  "id": "candidate-review-coverage-gap-senolytics-exact-effect-extraction-followup-3-repair-taxonomy-mapping-repair",
  "name": "Taxonomy mapping review for senolytics extraction follow-up repair",
  "summary": "Adds the missing taxonomy_mapping supervisor review for the senolytics exact-effect extraction follow-up repair candidate without promoting the target candidate.",
  "lifecycle_status": "submitted",
  "submitted_at": "2026-06-29T21:00:02Z",
  "scope": {
    "question": "candidate_review: Required review lane is missing: taxonomy_mapping.",
    "hallmark_ids": [
      "cellular_senescence"
    ],
    "track_ids": [
      "senolytics"
    ]
  },
  "proposed_records": [
    {
      "record_type": "candidate_change",
      "record_id": "candidate-review-coverage-gap-senolytics-exact-effect-extraction-followup-3-repair-taxonomy-mapping-repair",
      "path": "data/candidate-changes/candidate-review-coverage-gap-senolytics-exact-effect-extraction-followup-3-repair-taxonomy-mapping-repair.json",
      "change_type": "create",
      "rationale": "Tracks this bounded repair candidate and requires only the coordinator-specified taxonomy_mapping review lane."
    },
    {
      "record_type": "evidence_review",
      "record_id": "coverage-gap-senolytics-exact-effect-extraction-followup-3-repair-taxonomy-mapping",
      "path": "data/evidence-reviews/coverage-gap-senolytics-exact-effect-extraction-followup-3-repair-taxonomy-mapping.json",
      "change_type": "create",
      "rationale": "Adds the missing taxonomy_mapping supervisor review for coverage-gap-senolytics-exact-effect-extraction-followup-3-repair."
    }
  ],
  "required_review_lanes": [
    "taxonomy_mapping"
  ]
}
