{
  "schema_version": "1.0.0",
  "record_type": "candidate_change",
  "id": "candidate-review-coverage-gap-senolytics-exact-effect-extraction-followup-2-repair-taxonomy-mapping-repair",
  "name": "Add taxonomy mapping review for senolytics exact-effect repair candidate",
  "summary": "Creates the missing taxonomy_mapping supervisor evidence review for candidate coverage-gap-senolytics-exact-effect-extraction-followup-2-repair without promoting or mutating the target candidate.",
  "lifecycle_status": "submitted",
  "submitted_at": "2026-06-28T18:31:06Z",
  "scope": {
    "question": "Repair the missing taxonomy_mapping review lane for candidate coverage-gap-senolytics-exact-effect-extraction-followup-2-repair.",
    "hallmark_ids": [
      "cellular_senescence"
    ],
    "track_ids": [
      "senolytics"
    ]
  },
  "proposed_records": [
    {
      "record_type": "candidate_change",
      "record_id": "candidate-review-coverage-gap-senolytics-exact-effect-extraction-followup-2-repair-taxonomy-mapping-repair",
      "path": "data/candidate-changes/candidate-review-coverage-gap-senolytics-exact-effect-extraction-followup-2-repair-taxonomy-mapping-repair.json",
      "change_type": "create",
      "rationale": "Tracks the bounded repair candidate ledger for the missing taxonomy_mapping review lane."
    },
    {
      "record_type": "evidence_review",
      "record_id": "coverage-gap-senolytics-exact-effect-extraction-followup-2-repair-taxonomy-mapping",
      "path": "data/evidence-reviews/coverage-gap-senolytics-exact-effect-extraction-followup-2-repair-taxonomy-mapping.json",
      "change_type": "create",
      "rationale": "Adds a complete non-blocking taxonomy_mapping supervisor review for the target candidate."
    }
  ],
  "required_review_lanes": [
    "taxonomy_mapping"
  ]
}
