{
  "schema_version": "1.0.0",
  "record_type": "candidate_change",
  "id": "candidate-review-senolytics-dq-bone-pmc-fulltext-extraction-2026-06-22-source-fidelity-repair",
  "name": "Source-fidelity review repair for D+Q bone PMC full-text extraction",
  "summary": "Creates the missing source_fidelity supervisor review for senolytics-dq-bone-pmc-fulltext-extraction-2026-06-22. The review accepts the source chain, retained artifact hashes, source-rights boundary, and section locators for the PMC author-manuscript full-text extraction candidate.",
  "lifecycle_status": "submitted",
  "submitted_at": "2026-06-23T17:35:23Z",
  "scope": {
    "question": "Repair the missing source_fidelity review lane for the D+Q bone PMC full-text extraction candidate.",
    "hallmark_ids": [
      "cellular_senescence",
      "stem_cell_exhaustion"
    ],
    "track_ids": [
      "senolytics"
    ]
  },
  "proposed_records": [
    {
      "record_type": "candidate_change",
      "record_id": "candidate-review-senolytics-dq-bone-pmc-fulltext-extraction-2026-06-22-source-fidelity-repair",
      "path": "data/candidate-changes/candidate-review-senolytics-dq-bone-pmc-fulltext-extraction-2026-06-22-source-fidelity-repair.json",
      "change_type": "create",
      "rationale": "Tracks this bounded repair candidate for the missing source_fidelity review lane."
    },
    {
      "record_type": "evidence_review",
      "record_id": "senolytics-dq-bone-pmc-fulltext-extraction-2026-06-22-source-fidelity",
      "path": "data/evidence-reviews/senolytics-dq-bone-pmc-fulltext-extraction-2026-06-22-source-fidelity.json",
      "change_type": "create",
      "rationale": "Records the completed source-fidelity supervisor review for the D+Q bone PMC full-text extraction candidate."
    }
  ],
  "required_review_lanes": [
    "source_fidelity"
  ]
}
