{
  "schema_version": "1.0.0",
  "record_type": "candidate_change",
  "id": "candidate-review-extraction-debt-dq-bone-adverse-events-20wk-mixed-repair-taxonomy-mapping-repair",
  "name": "Taxonomy mapping supervisor review for D+Q bone adverse-event extraction-debt repair",
  "summary": "Adds the missing taxonomy_mapping supervisor review for extraction-debt-dq-bone-adverse-events-20wk-mixed-repair without promoting or mutating the target candidate.",
  "lifecycle_status": "submitted",
  "submitted_at": "2026-06-28T17:01:18Z",
  "scope": {
    "question": "candidate_review: Required review lane is missing: taxonomy_mapping.",
    "hallmark_ids": [
      "cellular_senescence",
      "chronic_inflammation",
      "stem_cell_exhaustion"
    ],
    "track_ids": [
      "senolytics"
    ]
  },
  "proposed_records": [
    {
      "record_type": "candidate_change",
      "record_id": "candidate-review-extraction-debt-dq-bone-adverse-events-20wk-mixed-repair-taxonomy-mapping-repair",
      "path": "data/candidate-changes/candidate-review-extraction-debt-dq-bone-adverse-events-20wk-mixed-repair-taxonomy-mapping-repair.json",
      "change_type": "create",
      "rationale": "Tracks the bounded repair candidate that supplies the missing taxonomy_mapping supervisor review."
    },
    {
      "record_type": "evidence_review",
      "record_id": "extraction-debt-dq-bone-adverse-events-20wk-mixed-repair-taxonomy-mapping",
      "path": "data/evidence-reviews/extraction-debt-dq-bone-adverse-events-20wk-mixed-repair-taxonomy-mapping.json",
      "change_type": "create",
      "rationale": "Records the complete non-blocking taxonomy_mapping review for extraction-debt-dq-bone-adverse-events-20wk-mixed-repair."
    }
  ],
  "required_review_lanes": [
    "safety_limitations",
    "taxonomy_mapping"
  ]
}
