{
  "schema_version": "1.0.0",
  "record_type": "candidate_change",
  "id": "orchestration-smoke-candidate-2026-06-22",
  "name": "Orchestration smoke candidate",
  "summary": "Synthetic self-contained candidate used to validate isolated Codex worker orchestration without proposing scientific evidence changes.",
  "lifecycle_status": "submitted",
  "submitted_at": "2026-06-23T00:00:20Z",
  "scope": {
    "question": "Battle-test isolated Codex orchestration with a harmless synthetic candidate output.",
    "hallmark_ids": [],
    "track_ids": []
  },
  "proposed_records": [
    {
      "record_type": "candidate_change",
      "record_id": "orchestration-smoke-candidate-2026-06-22",
      "path": "data/candidate-changes/orchestration-smoke-candidate-2026-06-22.json",
      "change_type": "create",
      "rationale": "Creates only this synthetic smoke-test candidate so orchestration ledgers can be validated without scientific evidence record changes."
    }
  ],
  "required_review_lanes": []
}
