{
  "schema_version": "1.0.0",
  "record_type": "candidate_change",
  "id": "candidate-review-candidate-revision-senolytics-bone-rct-extraction-refresh-2026-06-21-repair-extraction-fidelity-repair",
  "name": "Extraction-fidelity review repair for D+Q bone RCT revision candidate",
  "summary": "Creates the missing extraction_fidelity supervisor review for candidate-revision-senolytics-bone-rct-extraction-refresh-2026-06-21-repair. The review accepts this lane because the repair candidate accurately preserves the original D+Q extraction-refresh candidate as needs_revision and does not claim that unresolved publication-table, supplement/subgroup, or event-specific adverse-event extraction gaps have been corrected.",
  "lifecycle_status": "submitted",
  "submitted_at": "2026-06-23T19:29:03Z",
  "scope": {
    "question": "Add the missing extraction_fidelity review lane for the D+Q bone RCT extraction-refresh revision-state repair candidate.",
    "hallmark_ids": [
      "cellular_senescence",
      "chronic_inflammation",
      "stem_cell_exhaustion"
    ],
    "track_ids": [
      "senolytics"
    ]
  },
  "proposed_records": [
    {
      "record_type": "candidate_change",
      "record_id": "candidate-review-candidate-revision-senolytics-bone-rct-extraction-refresh-2026-06-21-repair-extraction-fidelity-repair",
      "path": "data/candidate-changes/candidate-review-candidate-revision-senolytics-bone-rct-extraction-refresh-2026-06-21-repair-extraction-fidelity-repair.json",
      "change_type": "create",
      "rationale": "Tracks the bounded self-healing repair that supplies the missing extraction_fidelity supervisor review lane."
    },
    {
      "record_type": "evidence_review",
      "record_id": "candidate-revision-senolytics-bone-rct-extraction-refresh-2026-06-21-repair-extraction-fidelity",
      "path": "data/evidence-reviews/candidate-revision-senolytics-bone-rct-extraction-refresh-2026-06-21-repair-extraction-fidelity.json",
      "change_type": "create",
      "rationale": "Adds the extraction_fidelity review for candidate-revision-senolytics-bone-rct-extraction-refresh-2026-06-21-repair."
    }
  ],
  "required_review_lanes": [
    "extraction_fidelity"
  ]
}
