{
  "schema_version": "1.0.0",
  "record_type": "candidate_change",
  "id": "candidate-review-extraction-debt-dq-bone-adverse-event-terms-20wk-mixed-repair-extraction-fidelity-repair",
  "name": "Extraction-fidelity review repair for D+Q bone adverse-event terms candidate",
  "summary": "Adds the missing extraction_fidelity supervisor review for extraction-debt-dq-bone-adverse-event-terms-20wk-mixed-repair without promoting or mutating the target candidate.",
  "lifecycle_status": "submitted",
  "submitted_at": "2026-06-27T21:50:00Z",
  "scope": {
    "question": "candidate_review: Required review lane is missing: extraction_fidelity.",
    "hallmark_ids": [
      "cellular_senescence",
      "chronic_inflammation",
      "stem_cell_exhaustion"
    ],
    "track_ids": [
      "senolytics"
    ]
  },
  "proposed_records": [
    {
      "record_type": "candidate_change",
      "record_id": "candidate-review-extraction-debt-dq-bone-adverse-event-terms-20wk-mixed-repair-extraction-fidelity-repair",
      "path": "data/candidate-changes/candidate-review-extraction-debt-dq-bone-adverse-event-terms-20wk-mixed-repair-extraction-fidelity-repair.json",
      "change_type": "create",
      "rationale": "Tracks the bounded self-healing repair candidate for the missing extraction_fidelity supervisor review lane."
    },
    {
      "record_type": "evidence_review",
      "record_id": "extraction-debt-dq-bone-adverse-event-terms-20wk-mixed-repair-extraction-fidelity",
      "path": "data/evidence-reviews/extraction-debt-dq-bone-adverse-event-terms-20wk-mixed-repair-extraction-fidelity.json",
      "change_type": "create",
      "rationale": "Records the completed extraction_fidelity supervisor review for the target D+Q bone adverse-event terms extraction-debt repair candidate."
    }
  ],
  "required_review_lanes": [
    "extraction_fidelity",
    "safety_limitations"
  ]
}
