{
  "schema_version": "1.0.0",
  "record_type": "candidate_change",
  "id": "candidate-review-senolytics-pubmed-snapshot-provenance-2026-06-27-source-fidelity-repair",
  "name": "Source-fidelity review repair for senolytics PubMed snapshot provenance",
  "summary": "Adds the missing source_fidelity supervisor evidence review for candidate senolytics-pubmed-snapshot-provenance-2026-06-27 without promoting or mutating the target candidate.",
  "lifecycle_status": "submitted",
  "submitted_at": "2026-06-27T19:52:28Z",
  "scope": {
    "question": "candidate_review: Required review lane is missing: source_fidelity.",
    "hallmark_ids": [
      "cellular_senescence"
    ],
    "track_ids": [
      "senolytics"
    ]
  },
  "proposed_records": [
    {
      "record_type": "candidate_change",
      "record_id": "candidate-review-senolytics-pubmed-snapshot-provenance-2026-06-27-source-fidelity-repair",
      "path": "data/candidate-changes/candidate-review-senolytics-pubmed-snapshot-provenance-2026-06-27-source-fidelity-repair.json",
      "change_type": "create",
      "rationale": "Tracks the bounded repair that creates the missing source_fidelity supervisor review record."
    },
    {
      "record_type": "evidence_review",
      "record_id": "senolytics-pubmed-snapshot-provenance-2026-06-27-source-fidelity",
      "path": "data/evidence-reviews/senolytics-pubmed-snapshot-provenance-2026-06-27-source-fidelity.json",
      "change_type": "create",
      "rationale": "Records the completed source_fidelity supervisor review for candidate senolytics-pubmed-snapshot-provenance-2026-06-27."
    }
  ],
  "required_review_lanes": [
    "source_fidelity"
  ]
}
